{
  "objective_id": "A21_FRONTEND_VISUAL_EXERCISE_DETAIL_E2E",
  "category": "FRONTEND_VISUAL_E2E",
  "target_friction_id": "read_only_visual_truth",
  "north_star_vector": ["honest feedback", "active replay"],
  "expected_e2e_potential": true,
  "expected_branch_count": 1,
  "expected_files": ["scripts/browser_exercise_detail_visual_followup.mjs"],
  "expected_time_minutes_min": 30,
  "expected_time_minutes_max": 55,
  "branch_overlap_risk": 12,
  "red_tier_risk": 0,
  "visual_audit_required": true,
  "visual_provider_available": true,
  "evidence_expected": ["screenshots", "contact sheet", "Gemini Visual JSON"],
  "marginal_value_score": 78,
  "confidence": 0.8,
  "reason_to_do_now": "Increases confidence that read-only UI claims remain truthful on desktop.",
  "reason_not_to_do": "Skip if Gemini image upload is unavailable or visual halting has blocked the branch.",
  "recommended_phase": "ADAPTIVE_EXTENSION"
}
