{
  "objective_id": "A21_CONSOLIDATE_A20_5_BRANCH_EVIDENCE",
  "category": "BRANCH_CONSOLIDATION",
  "target_friction_id": "morning_review_confidence",
  "north_star_vector": ["honest feedback"],
  "expected_e2e_potential": false,
  "expected_branch_count": 0,
  "expected_files": [],
  "expected_time_minutes_min": 15,
  "expected_time_minutes_max": 30,
  "branch_overlap_risk": 5,
  "red_tier_risk": 0,
  "visual_audit_required": false,
  "visual_provider_available": true,
  "evidence_expected": ["branch classification report", "evidence index validation"],
  "marginal_value_score": 62,
  "confidence": 0.75,
  "reason_to_do_now": "Improves reviewability when product branches already exist.",
  "reason_not_to_do": "Do not use as filler when a stronger product E2E objective is available.",
  "recommended_phase": "CONSOLIDATION"
}
